{
  "name": "notion-workspace",
  "version": "1.0.0",
  "description": "Interact with your Notion workspace - search pages, query databases and create new content.",
  "author": {
    "name": "AgentHaus Team"
  },
  "homepage": "https://github.com/savethepolarbears/agenthaus-marketplace",
  "repository": "https://github.com/savethepolarbears/agenthaus-marketplace",
  "license": "MIT",
  "tags": [
    "knowledge",
    "notes",
    "wiki"
  ],
  "commands": [
    "./commands/search.md",
    "./commands/create-page.md"
  ],
  "skills": [
    "./skills/notion-management"
  ]
}
