{
  "name": "playwright-testing",
  "version": "1.0.0",
  "description": "End-to-end browser automation and testing using Playwright.",
  "author": {
    "name": "AgentHaus Team"
  },
  "homepage": "https://github.com/savethepolarbears/agenthaus-marketplace",
  "repository": "https://github.com/savethepolarbears/agenthaus-marketplace",
  "license": "MIT",
  "tags": [
    "testing",
    "e2e",
    "browser-automation"
  ],
  "agents": [
    "./agents/qa-engineer.md"
  ],
  "skills": [
    "./skills/e2e-testing"
  ]
}
