{
  "name": "data-core",
  "version": "1.0.0",
  "description": "Serverless Postgres database management via Neon.",
  "author": {
    "name": "AgentHaus Team"
  },
  "homepage": "https://github.com/savethepolarbears/agenthaus-marketplace",
  "repository": "https://github.com/savethepolarbears/agenthaus-marketplace",
  "license": "MIT",
  "tags": [
    "database",
    "postgres",
    "migrations"
  ],
  "mcpServers": {
    "postgres": {
      "command": "npx",
      "args": [
        "-y",
        "@modelcontextprotocol/server-postgres",
        "${NEON_DATABASE_URL}"
      ],
      "env": {}
    }
  },
  "skills": [
    "./skills/postgres-operations"
  ]
}
