{
  "name": "cloudflare-platform",
  "version": "1.0.0",
  "description": "Manage Cloudflare Workers, KV storage and AI Gateway resources.",
  "author": {
    "name": "AgentHaus Team"
  },
  "homepage": "https://github.com/savethepolarbears/agenthaus-marketplace",
  "repository": "https://github.com/savethepolarbears/agenthaus-marketplace",
  "license": "MIT",
  "tags": [
    "cloud",
    "deployment",
    "serverless"
  ],
  "commands": [
    "./commands/deploy.md",
    "./commands/kv.md"
  ],
  "skills": [
    "./skills/cloudflare-deploy"
  ]
}
