{
  "name": "agent-handoff",
  "version": "1.0.0",
  "description": "State-based task handoff between agents using a shared blackboard protocol.",
  "author": {
    "name": "AgentHaus Team"
  },
  "homepage": "https://github.com/savethepolarbears/agenthaus-marketplace",
  "repository": "https://github.com/savethepolarbears/agenthaus-marketplace",
  "license": "MIT",
  "tags": [
    "orchestration",
    "multi-agent",
    "task-management"
  ],
  "commands": [
    "./commands/dispatch.md",
    "./commands/claim.md",
    "./commands/status.md"
  ],
  "skills": [
    "./skills/blackboard-protocol"
  ]
}
