{
  "name": "shadow-mode",
  "version": "1.0.1",
  "description": "Agents draft outputs to a review queue instead of executing directly.",
  "author": {
    "name": "AgentHaus Team"
  },
  "homepage": "https://github.com/savethepolarbears/agenthaus-marketplace",
  "repository": "https://github.com/savethepolarbears/agenthaus-marketplace",
  "license": "MIT",
  "tags": [
    "training",
    "safety",
    "review"
  ],
  "commands": [
    "./commands/enable.md",
    "./commands/disable.md",
    "./commands/review.md"
  ],
  "skills": [
    "./skills/shadow-review"
  ]
}
